[
  {
    "id": "AQ-BRT-001",
    "title": "rank(D)=m-c_comp",
    "status": "verified",
    "governance": "active",
    "evidence": "166483 cases, 0 viol",
    "cases": 166483,
    "violations": 0,
    "note": ""
  },
  {
    "id": "AQ-BRT-PULLBACK",
    "title": "D=0 iff compatible (pullback K)",
    "status": "verified",
    "governance": "active",
    "evidence": "9372 cases, 0 viol",
    "cases": 9372,
    "violations": 0,
    "note": ""
  },
  {
    "id": "AQ-BRT-PUSH-DEP",
    "title": "Pushforward D=0 iff compatible",
    "status": "deprecated",
    "governance": "deprecated",
    "evidence": "18.7% failure rate",
    "cases": 0,
    "violations": 0,
    "note": ""
  },
  {
    "id": "AQ-C04",
    "title": "Refinement: \u0394rank=1-\u0394c",
    "status": "verified",
    "governance": "active",
    "evidence": "7218 cases, 0 viol",
    "cases": 7218,
    "violations": 0,
    "note": ""
  },
  {
    "id": "AQ-C04-MONO-DEP",
    "title": "Refinement weakly increases rank",
    "status": "deprecated",
    "governance": "deprecated",
    "evidence": "counterexample found",
    "cases": 0,
    "violations": 0,
    "note": ""
  },
  {
    "id": "AQ-C05",
    "title": "Coarsening: \u0394rank=-1-\u0394c",
    "status": "verified",
    "governance": "active",
    "evidence": "8101 cases, 0 viol",
    "cases": 8101,
    "violations": 0,
    "note": ""
  },
  {
    "id": "AQ-DELTA-001",
    "title": "delta(k,d) forbidden-set formula",
    "status": "verified",
    "governance": "active",
    "evidence": "119/119 cases",
    "cases": 119,
    "violations": 0,
    "note": ""
  },
  {
    "id": "AQ-DELTA-DEP",
    "title": "delta=k/gcd(d,k) (doc-35)",
    "status": "deprecated",
    "governance": "deprecated",
    "evidence": "4.2% accuracy (5/119)",
    "cases": 119,
    "violations": 0,
    "note": ""
  },
  {
    "id": "AQ-GCD-CLOSURE",
    "title": "FOQDS closure gives gcd(d,k) blocks",
    "status": "verified",
    "governance": "active",
    "evidence": "119/119 cases",
    "cases": 119,
    "violations": 0,
    "note": ""
  },
  {
    "id": "AQ-IP-MIP",
    "title": "IP=1-sqrt(4p(1-p)) equal-blocks",
    "status": "verified",
    "governance": "active",
    "evidence": "90/90 cases",
    "cases": 90,
    "violations": 0,
    "note": ""
  },
  {
    "id": "AQ-KERNEL-PHI",
    "title": "null(DPhi)=c_comp, rank(DPhi)=rank(D)",
    "status": "verified",
    "governance": "active",
    "evidence": "166483 cases, 0 viol",
    "cases": 166483,
    "violations": 0,
    "note": ""
  },
  {
    "id": "AQ-P01-DEP",
    "title": "null(D*Phi)=null(B_F^T) binary",
    "status": "deprecated",
    "governance": "deprecated",
    "evidence": "153511/166483 fail",
    "cases": 166483,
    "violations": 0,
    "note": ""
  },
  {
    "id": "AQ-SIGMA-001",
    "title": "sigma^2=(ab/a+cd/b)(1/a+1/b)",
    "status": "verified",
    "governance": "active",
    "evidence": "6000+ cases, 0 viol",
    "cases": 6000,
    "violations": 0,
    "note": ""
  },
  {
    "id": "AQ-SOURCE-SPLIT",
    "title": "{S,Im(T)} always exact (D=0)",
    "status": "verified",
    "governance": "active",
    "evidence": "49000+ cases, 0 viol",
    "cases": 49000,
    "violations": 0,
    "note": ""
  },
  {
    "id": "AQ-SUPP-MONO-DEP",
    "title": "Refinement can only add to supp_block",
    "status": "deprecated",
    "governance": "deprecated",
    "evidence": "split can make compat",
    "cases": 0,
    "violations": 0,
    "note": ""
  },
  {
    "id": "AQ-T10-BLOCK",
    "title": "supp_block(D)=split-source edges",
    "status": "verified",
    "governance": "active",
    "evidence": "166483 cases, 0 viol",
    "cases": 166483,
    "violations": 0,
    "note": ""
  },
  {
    "id": "AQ-T10-STATE-DEP",
    "title": "supp(D) determined by G(Pi,T) at state level",
    "status": "deprecated",
    "governance": "deprecated",
    "evidence": "58 violations n=4",
    "cases": 0,
    "violations": 0,
    "note": ""
  },
  {
    "id": "KAP-GRADED-D4",
    "title": "d=4 graded iff b in {5,10} (b<=20)",
    "status": "verified",
    "governance": "active",
    "evidence": "b=3..20 verified",
    "cases": 0,
    "violations": 0,
    "note": ""
  },
  {
    "id": "KAP-GRADED-D6",
    "title": "d=6 graded iff b in {13,17} (b<=20)",
    "status": "verified",
    "governance": "active",
    "evidence": "gap-space b=5..20",
    "cases": 0,
    "violations": 0,
    "note": ""
  },
  {
    "id": "KAP-HEIGHT-D4",
    "title": "d=4 heights: 4,7",
    "status": "verified",
    "governance": "active",
    "evidence": "b=5:h=4, b=10:h=7",
    "cases": 0,
    "violations": 0,
    "note": ""
  },
  {
    "id": "KAP-HEIGHT-D6",
    "title": "d=6 heights: 19,39",
    "status": "verified",
    "governance": "active",
    "evidence": "b=13:h=19, b=17:h=39",
    "cases": 0,
    "violations": 0,
    "note": ""
  },
  {
    "id": "KAP-HEIGHT-FORMULA",
    "title": "Height closed-form for graded (b,d)",
    "status": "open",
    "governance": "active",
    "evidence": "no formula found",
    "cases": 0,
    "violations": 0,
    "note": ""
  },
  {
    "id": "KAP-IMAGE-CHAIN",
    "title": "54\u219220\u219214\u219210\u21927\u21924\u21921",
    "status": "verified",
    "governance": "active",
    "evidence": "computed exactly",
    "cases": 0,
    "violations": 0,
    "note": ""
  },
  {
    "id": "KAP-MU1-DEP",
    "title": "mu1=0.1614364845",
    "status": "deprecated",
    "governance": "deprecated",
    "evidence": "wrong Laplacian, correct=0.0016",
    "cases": 0,
    "violations": 0,
    "note": ""
  },
  {
    "id": "KAP-NIL-DEP",
    "title": "nilpotent ranks [20,14,9,4,2,1,0]",
    "status": "deprecated",
    "governance": "deprecated",
    "evidence": "off-by-offset error",
    "cases": 0,
    "violations": 0,
    "note": ""
  },
  {
    "id": "KAP-NIL-RANKS",
    "title": "nilpotent ranks [53,19,13,9,6,3,0]",
    "status": "verified",
    "governance": "active",
    "evidence": "corrected from registry",
    "cases": 0,
    "violations": 0,
    "note": ""
  },
  {
    "id": "KAP-RANK-IDENTITY",
    "title": "rank(N^k)=chain[k]-1",
    "status": "verified",
    "governance": "active",
    "evidence": "k=0..6 verified",
    "cases": 0,
    "violations": 0,
    "note": ""
  },
  {
    "id": "KAP-SG-ORDER-DEP",
    "title": "Semigroup order 8",
    "status": "deprecated",
    "governance": "deprecated",
    "evidence": "corrected to 6",
    "cases": 0,
    "violations": 0,
    "note": ""
  },
  {
    "id": "KAP-WEYR",
    "title": "Weyr [34,6,4,3,3,3]=Jordan{1:28,2:2,3:1,6:3}",
    "status": "verified",
    "governance": "active",
    "evidence": "exact",
    "cases": 0,
    "violations": 0,
    "note": ""
  },
  {
    "id": "LEAN-GCD-CLOSURE",
    "title": "Lean 4 proof of GCD-closure",
    "status": "open",
    "governance": "active",
    "evidence": "no build receipt",
    "cases": 0,
    "violations": 0,
    "note": ""
  },
  {
    "id": "LEAN-T1",
    "title": "Lean 4 proof of T1 diff formula",
    "status": "open",
    "governance": "active",
    "evidence": "no build receipt",
    "cases": 0,
    "violations": 0,
    "note": ""
  },
  {
    "id": "PB-005-FORMULA",
    "title": "N(\u03bb)=\u03a3\u03c0 \u03a0b(\u03a3d|gcd d^(|B|-1)) [cycle-type]",
    "status": "verified",
    "governance": "deprecated",
    "evidence": "138 cycle types n\u226410, 5.6M cases, 0 mismatches",
    "cases": 5612287,
    "violations": 0,
    "note": "Mathematically correct but equivalent to Constantineau-Labelle 1991, Prop 6.3 eq(18); rediscovery, not novel."
  },
  {
    "id": "PB-006-NOVELTY",
    "title": "PB-006 formula is novel",
    "status": "deprecated",
    "governance": "deprecated",
    "evidence": "Constantineau-Labelle 1991 unresolved",
    "cases": 0,
    "violations": 0,
    "note": "Comparison complete: PB-005 formula is eq(18) of Constantineau-Labelle 1991; not novel."
  },
  {
    "id": "T-IM",
    "title": "pi(Im(K))=Q20=join-of-atoms",
    "status": "conjecture",
    "governance": "active",
    "evidence": "three-fold identity",
    "cases": 0,
    "violations": 0,
    "note": ""
  },
  {
    "id": "T-SG",
    "title": "Semigroup order 6, index 6",
    "status": "verified",
    "governance": "active",
    "evidence": "semigroup order=6",
    "cases": 0,
    "violations": 0,
    "note": ""
  },
  {
    "id": "T1-DIFF-FORMULA",
    "title": "diff=999g1+90g2",
    "status": "conjecture",
    "governance": "active",
    "evidence": "algebraic derivation (proof status unconfirmed)",
    "cases": 0,
    "violations": 0,
    "note": ""
  },
  {
    "id": "T2-SEMICONJUGACY",
    "title": "pi\u2218K=K_G\u2218pi (OP-19)",
    "status": "conjecture",
    "governance": "active",
    "evidence": "corollary of T1",
    "cases": 0,
    "violations": 0,
    "note": ""
  },
  {
    "id": "T3-GAP-NERODE",
    "title": "Gap=Nerode for gap observable",
    "status": "conjecture",
    "governance": "active",
    "evidence": "scope: gap obs only",
    "cases": 0,
    "violations": 0,
    "note": ""
  },
  {
    "id": "T4-ARBORESCENCE",
    "title": "Q54 graded in-arborescence h=6",
    "status": "verified",
    "governance": "active",
    "evidence": "705 states, 0 viol",
    "cases": 0,
    "violations": 0,
    "note": ""
  },
  {
    "id": "T5-BORROW-SIG",
    "title": "Borrow sig=(1,1,[g2=0])",
    "status": "conjecture",
    "governance": "active",
    "evidence": "symbolic derivation (proof status unconfirmed)",
    "cases": 0,
    "violations": 0,
    "note": ""
  },
  {
    "id": "T6-FIXEDPT-5B",
    "title": "Fixed pt iff 5|b, d=4",
    "status": "verified",
    "governance": "active",
    "evidence": "b<=50 verified",
    "cases": 0,
    "violations": 0,
    "note": ""
  },
  {
    "id": "T7-NUEZ-FORMULA",
    "title": "|Q_b|=C(b+1,2)-1",
    "status": "conjecture",
    "governance": "active",
    "evidence": "combinatorial derivation (proof status unconfirmed)",
    "cases": 0,
    "violations": 0,
    "note": ""
  },
  {
    "id": "T9-Q20-SYMBOLIC",